main_category,sub_category,definition_text
WordPress,Themes,"Articles about selecting, installing, customizing, and troubleshooting WordPress themes, including theme performance, compatibility, and appearance."
WordPress,Plugins,"Articles about installing, configuring, and troubleshooting WordPress plugins, including security, caching, SEO plugins, and plugin conflicts."
WordPress,Troubleshooting,"Articles focused on diagnosing and fixing WordPress issues such as login errors, white screen, update failures, database errors, and site breakage."
WordPress,Development,"Articles about WordPress development topics including custom code, child themes, hooks, templates, staging, migrations, and best practices."
Hosting,Web Hosting,"Articles about shared web hosting plans, setup, account basics, performance tips, and common hosting configuration/troubleshooting."
Hosting,VPS Hosting,"Articles focused on virtual private server (VPS) hosting, including server resources, CPU/RAM allocation, scalability, SSH access, operating systems, performance benchmarks, pricing tiers, plan comparisons, use cases, and technical control. Common topics include VPS reviews, comparisons, migrations from shared hosting, server performance, security configurations, and choosing VPS plans for growing or high-traffic websites. Includes WordPress only when discussed in the context of VPS performance or infrastructure."
Hosting,Dedicated Hosting,"Articles about dedicated hosting servers, provisioning, configuration, server administration, and performance/security management."
Hosting,Cloud Hosting,"Articles about cloud hosting setup, scalability, availability, and managing websites/apps on cloud infrastructure."
Hosting,WordPress Hosting,"Articles focused specifically on managed WordPress hosting experiences and workflows. Covers WordPress-first hosting features such as one-click installs, automatic updates, backups, staging environments, security hardening, caching, performance tuning for WordPress sites, onboarding guides, and day-to-day site management. Excludes infrastructure deep-dives, server resource comparisons, benchmarks, or hosting plan reviews."
Marketing,SEO,"Articles about search engine optimization including keyword research, on-page SEO, technical SEO, site structure, indexing, and improving organic visibility."
Marketing,Email Marketing,"Articles about email marketing strategy, building lists, campaigns, deliverability, email tools, and email performance measurement."
Marketing,Social Media,"Articles about social media marketing including channel strategy, content planning, growth, engagement, and promotion across platforms."
Marketing,Content Marketing,"Articles about content strategy, blogging, topic planning, content optimization, and building authority using helpful content."
Marketing,Performance Marketing,"Articles about paid marketing and growth tactics including PPC, paid social, landing pages, conversion tracking, and ROI optimization."
Security,,"Articles about website security including SSL/TLS, malware protection, backups, security best practices, and keeping websites safe from threats."
eCommerce,WooCommerce,"Articles about using WooCommerce on WordPress including setup, payments, products, shipping, plugins, and eCommerce troubleshooting."
eCommerce,Sell Online,"Articles about starting and running an online store including platforms, product setup, checkout, payments, and growth strategies for selling online."
Domains,DNS,"Articles about DNS records and domain pointing including A/CNAME/TXT records, nameservers, propagation, and troubleshooting DNS issues."
Domains,TLDs,"Articles about top-level domains (TLDs) including choosing domain extensions, availability, use cases, and branding considerations."
Domains,Domain Registration,"Articles about registering domains including purchase, renewal, transfers, ownership, and managing domain settings."
Domains,Premium Domains,"Articles about premium domains including pricing, valuation, benefits, and considerations for buying high-value domain names."
News,Product Updates,"Company announcements and product updates related to Bluehost features, releases, improvements, and changes."
News,Industry Trends,"Articles about web hosting and digital industry trends including WordPress ecosystem updates, marketing trends, and broader market insights."
News,Bluehost News,"Bluehost-specific news, announcements, initiatives, partnerships, and company-related updates."
Client Stories,Testimonials,Customer testimonials and success highlights showcasing experiences and outcomes using Bluehost products and services.
Client Stories,Case Studies,"Detailed customer case studies describing goals, implementation, results, and lessons learned using Bluehost solutions."
Website,Design,"Articles about website design including UI/UX basics, templates, branding, layout, and improving website visuals and usability."
Website,Development,"Articles about website development including building pages, coding basics, CMS usage, integrations, and web development best practices."
Website,Performance,"Articles about website performance including speed optimization, Core Web Vitals, caching, image optimization, and improving user experience."
Affiliate,,"Articles about Bluehost affiliate program topics including referrals, commissions, promotional strategies, and affiliate best practices."
Business,,"Articles about running and growing a business online including entrepreneurship, strategy, operations, and digital presence fundamentals."
AI Insights,,"Discover how AI is reshaping websites, content creation, and hosting performance. Get expert tips and the latest AI insights from Bluehost’s blogs."